"lat","lng","Address"
52.726119,-2.114326,"Corner spice limited , William Hardings House, Mill Street, Stafford, Staffordshire, ST19 5AY"
53.04799,-2.140193,"Spice Exchange, 1870 Leek Road, , Stoke-on-Trent, Staffordshire, ST2 7AF"
51.465067,-0.157578,"Palace Spice, 139 Lavender Hill, , London, Greater London, SW11 5QJ"
51.465261,-0.259784,"Rosona Spice, 130 Upper Richmond Road West, , London, Greater London, SW14 8DS"
51.432822,-0.129365,"Racs real juice , Unit 2, 156 Streatham High Road, London, Greater London, SW16 1BJ"
51.414088,-0.124162,"Spice Lounge , 437-439, Streatham High Road, London, Greater London, SW16 3PH"
51.440831,-0.154668,"Telpani Services Limited , 1 The Boulevard, , London, Greater London, SW17 7BW"
51.43466,-0.161996,"Spice Village Tooting , 32-36 Upper Tooting Road, , London, Greater London, SW17 7PD"
51.432025,-0.163684,"L S Catering ltd T/A Lahore Spices, 111-113 Upper Tooting Road, , London, Greater London, SW17 7TJ"
51.506583,-0.125668,"Civil Service Club, 13-15, Great Scotland Yard, London, Greater London, SW1A 2HJ"
51.494058,-0.151249,"Baker & Spice (London) Limited - Belgravia, 54-56 Elizabeth St, Belgravia, London, , SW1W 9PB"
51.509615,-0.131831,"Busaba Leicester Square, 35a, Panton Street, London, Greater London, SW1Y 4EA"
51.410867,-0.21919,"House Of Spice, 507 Kingston Road, , London, Greater London, SW20 8SF"
51.493927,-0.164723,"Baker And Spice (London) Ltd - Chelsea, 47 Denyer St, , London, , SW3 2LX"
51.485332,-0.174575,"Ranoush Juice 338 King's Road, 338 Kings Road, , London, Greater London, SW3 5UR"
51.493771,-0.195088,"Dolci Coffee & Juice Ltd, 176 Earls Court Road, , London, Greater London, SW5 9QQ"
52.706575,-2.752553,"The Old Post Office, the old post office, 1 milk strret, shrewsbury, , SY1 1SZ"
52.969646,-2.678572,"Blue Water Spices Indian Ltd, Blue Water Indian Restaurant , Brownlow Street , Whitchurch , Shropshire , SY13 1QP"
52.686544,-3.464331,"Cann Office Hotel, Cann Office, Llangadfan, Welshpool, Powys, SY21 0PL"
52.7911,-2.8534,"Adi exclusives Ltd trade as Admiral spice , Living Accommodation,Admiral Duncan, Newtown, Baschurch, Shropshire, SY4 2AY"
52.647928,-2.890089,"Balti spice, The Old Bakehouse, Brookside, Shrewsbury, Shropshire, SY5 0QF"
51.019962,-3.066149,"Subway taunton deane service, Subway taunton  deane service ,  Black brook Avenue , Taunton , Somerset, TA1 2UH"
51.206052,-3.477933,"Mr.Micawbers licensed restaurant , 15a, The Parade, Minehead, , TA24 5NL"
51.160938,-3.321234,"Bengal Spice, 7 Fore Street, Williton, Taunton, , TA4 4PX"
51.128804,-2.999851,"Spice club , 10 Eastover, , Bridgwater, Somerset, TA6 5AB"
55.770814,-2.005186,"Thistle do nicely , 8 Walkergate, , Berwick-upon-Tweed, Northumberland, TD15 1DB"
55.547216,-2.842104,"Taste of Spice, 3 Market Place, , Selkirk, Roxburgh, Ettrick and Lauderdale, TD7 4BT"
52.676955,-2.481884,"shahab spices ltd trading as ashukaa, Unit 14, Birchfield Way, Telford, Shropshire, TF3 5BZ"
51.133174,0.265541,"Souper Juice, 11, Monson Road, Tunbridge Wells, , TN1 1LS"
51.137893,0.269847,"The spice, 161-163, Camden Road, Tunbridge Wells, Kent, TN1 2RF"
51.172494,0.182304,"The Leicester Arms, High Street, Penshurst, Tonbridge, Kent, TN11 8BT"
51.307765,0.040487,"Spice lounge, 226 Main Road, Biggin Hill, Westerham, Greater London, TN16 3BD"
50.986574,0.474897,"New spice ag ltd , 13 High Street, , Robertsbridge, East Sussex, TN32 5AE"
51.047235,0.407061,"The Bell in Ticehurst LLP, High Street, Ticehurst, Wadhurst, East Sussex, TN5 7AS"
51.048027,0.187448,"Crowborough Spice, 24 Crowborough Hill, , Jarvis Brook, East Sussex, TN6 2JE"
50.461393,-3.520741,"simla spice , 39-41 Torwood Street, , Torquay, Devon, TQ1 1DZ"
50.436373,-3.567451,"Holmans Courtyard Cafe and Juice Bar, 9 The Gerstons, , Paignton, Devon, TQ3 3AD"
50.264938,-5.054175,"Sole Plaice, 20 Pydar Street, , Truro, Cornwall, TR1 2AY"
50.216728,-5.477318,"Porthgwidden Beach Services, Porthgwidden, , St. Ives, Cornwall, TR26 1PL"
50.208239,-5.477766,"Porthminster Beach Services, Beach Office, Porthminster, St. Ives, Cornwall, TR26 2EB"
54.571247,-1.237895,"icestone gelato, 201, linthorpe road, middlesbourgh, teeside, TS1 3RF"
54.572919,-1.238669,"Fire and Dice Games, 39-41, Borough Road, Middlesbrough, North Yorkshire, TS1 4AF"
54.619735,-1.06992,"Bengal Spice , 15 Station Road, , Redcar, North Yorkshire, TS10 1AH"
54.582842,-0.974009,"Spice (Saltburn) Ltd, 21 Station Street, , Saltburn-by-the-Sea, North Yorkshire, TS12 1AE"
54.582842,-0.974009,"Spice, 21 Station Street, , Saltburn-by-the-Sea, North Yorkshire, TS12 1AE"
54.693188,-1.431061,"Cinnamon Spice Club, Cinnamon Club, Salters Lane, Trimdon, Durham, TS29 6JQ"
51.482213,-0.312757,"Holy Spice, 1 London Road, , Brentford, Greater London, TW8 8JB"
51.512224,-0.384585,"Spice Village , 185-189, The Broadway, Southall, Greater London, UB1 1LX"
51.516312,-0.205549,"Brown Rice , 207-209, Portobello Road, London, Greater London, W11 1LU"
51.510696,-0.225806,"Homeslice White City, 2 Television Centre, 101 Wood Lane, London, Greater London, W12 7FR"
51.502829,-0.316938,"Spice Magic, 122 Northfield Avenue, , London, Greater London, W13 9RT"
51.514586,-0.152839,"Baker And Spice (London) Ltd - Selfridges, 400 Oxford Street, , London, Greater London, W1A 1AB"
51.510602,-0.131873,"Shake Shack Leicester Square, 1-2 Coventry Street, , London, , W1D 6BH"
51.511539,-0.132498,"Rice Coming CT Restaurant, 45 Wardour Street, , London, Greater London, W1D 6PZ"
51.513476,-0.135013,"Duck and Rice   , 90 Berwick Street, , London, Greater London, W1F 0QB"
51.508282,-0.145442,"Fitzmaurice House ltd t/a the Lansdowne Club, The Lansdowne Club, 9 Fitzmaurice Place, London, London, W1J 5JD"
51.524144,-0.140257,"Honey & Spice, 52 Warren Street, , London, Greater London, W1T 5NJ"
51.515676,-0.150734,"Homeslice Marylebone, 50 James Street, , London, Greater London, W1U 1HB"
51.513896,-0.162206,"victory services club, 63-79, Seymour Street, London, Greater London, W2 2HF"
51.514504,-0.162556,"Ranoush Juice 43 Edgware Road, 43 Edgware Road, , London, Greater London, W2 2JE"
51.49276,-0.265168,"Wild Bunch juicery , 402 Chiswick High Road, , London, Greater London, W4 5TF"
51.492362,-0.23023,"Brown Rice , 103 King Street, , London, Greater London, W6 9JG"
51.501685,-0.192196,"Ranoush Juice, 86 Kensington High Street, , London, Greater London, W8 4SG"
51.525716,-0.179735,"Baker & Spice (London) Limited - Maida Vale, 20 Clifton Rd, Maida Vale, London, , W9 1SU"
53.380718,-2.478086,"Lymm Spice Lounge, Ground Floor, 6 The Cross, Warrington, Cheshire, WA13 0HP"
53.385641,-2.352044,"Good Choice , 7a, Regent Road, Altrincham, Greater Manchester, WA14 1RY"
53.430547,-2.500815,"Birchwood spice, 40 Gorse Covert Road, Birchwood, Warrington, Cheshire, WA3 6UG"
53.377346,-2.692404,"Spice of India , Spice of India , WIDNES road , WARRIGTON, , WA5 2XD"
51.517341,-0.126282,"Rice Coming Restaurant, 10A Coptic Street, , London, Greater London, WC1A 1NH"
51.511698,-0.127822,"Wok to Walk Leicester Limited, 22 Cranbourn Street, , London, Greater London, WC2H 7AA"
51.658637,-0.366589,"Metropolitan Police Bushey Sports Club, Aldenham Road, , Bushey, Hertfordshire, WD23 2TR"
51.657867,-0.271919,"Spice Garden, 209 Shenley Road, , Borehamwood, Hertfordshire, WD6 1AT"
51.686108,-0.318844,"The Office Bar, 58 Watling Street, , Radlett, Hertfordshire, WD7 7NN"
53.681938,-1.495452,"Mr Juice Fresh Smoothie Bar, Kiosk 1, All Saints Walk the Ridings Centre, Wakefield, West Yorkshire, WF1 1DS"
53.682777,-1.499876,"Silver Spice Ltd , 14 Silver Street, , Wakefield, West Yorkshire, WF1 1UY"
53.684602,-1.499991,"Felice’s Bella Roma , 63 Northgate , , Wakefield, West Yorkshire , WF1 3BP"
53.717773,-1.271228,"Harmans On Site Services Ltd, RWE Generation, Ferrybridge Powert Station, Ferrybirdge, , WF11 8PR"
53.713128,-1.630848,"icestone gelato, 35-37, Commercial Street, Batley, West Yorkshire, WF17 5EP"
53.650818,-1.596232,"The Spiced Mango, 93 New Road, Middlestown, Wakefield, West Yorkshire, WF4 4NS"
53.699658,-1.297711,"Harmans On Site Services Ltd, Monkhill, Ferrybridge Road, Pontefract, West Yorkshire, WF8 2JS"
53.543462,-2.642777,"Fresh Choice Cafes Ltd, 1 Wilcock Street , , Wigan, Lancashire, WN3 4AR"
52.192937,-2.220382,"St Richards Hospice Snowdrop Cafe, 13-14, St. Swithins Street, Worcester, Worcestershire, WR1 2PS"
52.110514,-2.075337,"Sugar n Spice, 20 High Street, , Pershore, Worcestershire, WR10 1BG"
52.312744,-2.17985,"Cutnall Green post office, Cutnall green post office, School lane, Cutnall green, Worcestershire, WR9 0PQ"
52.267998,-2.148852,"Spice Fuzion Ltd, 17 St. Andrews Street, , Droitwich, Worcestershire, WR9 8DY"
52.552424,-2.026469,"spices restaurany & takeaway wednesbury ltd, 81 holyhead road, , wednesbury, west midland, WS10 7PA"
52.680477,-2.026966,"Aydan spice ltd, 172 Walsall Road, , Cannock, Staffordshire, WS11 0JB"
52.70815,-1.998181,"spice of hednesford, 13 Market Street, Hednesford, Cannock, Staffordshire, WS12 1AY"
52.603723,-1.91939,"Faz Spice LTD, 47 Anchor Road, , Walsall, West Midlands, WS9 8PT"
52.585593,-2.128313,"Alice's Tea Room, 18 Queen Square, , Wolverhampton, West Midlands, WV1 1TQ"
52.583747,-2.070563,"Spice Lounge, 657 Willenhall Road, , Willenhall, West Midlands, WV13 3LH"
52.53478,-2.413232,"The spice of friends ltd  T/A blue Ginger , 12 Mill Street, , Bridgnorth, Shropshire, WV15 5AL"
52.568322,-2.167573,"5 Spice Cuisine Ltd, 15 Warstones Drive, , Wolverhampton, West Midlands, WV4 4PP"
52.625428,-2.189493,"Codsall Spice, 139 Wolverhampton Road, Codsall, Wolverhampton, Staffordshire, WV8 1PF"
53.961208,-1.08008,"Bombay Spice, 58 Goodramgate, , York, North Yorkshire, YO1 7LF"
54.282813,-0.412023,"Nishat Spice , Nishat Spice Restaurant, 47 Prospect Road, Scarborough, North Yorkshire, YO12 7JX"
54.244774,-0.776833,"Spice 4 U, 41 Hungate, , Pickering, North Yorkshire, YO18 7DG"
54.257505,-0.799393,"Middleton Post Office Tea Parlour, Post Office, , Main Street, Middleton, Pickering, North Yorkshire, YO18 8NX"
53.945791,-1.08566,"village spice, 162 Bishopthorpe Road, , York, North Yorkshire, YO23 1LF"
53.971738,-1.131469,"Harmans On Site Services Ltd, Valeo Tangerine, Low Poppleton Lane, York, North Yorkshire, YO26 6BA"
54.01338,-1.226317,"The Alice Hawthorn, The Green, Nun Monkton, York, North Yorkshire, YO26 8EW"
53.970221,-1.079836,"Jaipur Spice, Jaipur Spice, 103 Haxby Road, York, North Yorkshire, YO31 8JS"
54.016278,-1.074226,"Janna Spice, 27 The Village, Haxby, York, North Yorkshire, YO32 3HS"
54.016278,-1.074226,"Janna spice , 27 The Village, Haxby, York, North Yorkshire, YO32 3HS"
53.920441,-0.795661,"Bakery Pocklington Services, Broadhelm Close, Pocklington, York, East Riding of Yorkshire, YO42 1AD"
53.920441,-0.795661,"Subway Pocklington Services, Broadhelm Close, Pocklington, York, East Riding of Yorkshire, YO42 1AD"
54.105264,-1.192668,"Jaipur Spice, Jaipur Spice, York Road, Easingwold, North Yorkshire, YO61 3PG"
54.245854,-1.060347,"Hemsley Spice Ltd, 1 Bridge Street, Helmsley, York, North Yorkshire, YO62 5BG"
54.25313,-0.997297,"Fusion Spice Coffee Limited , Main Road, Beadlam Nawton, York, North Yorkshire, YO62 7SU"
